### ISSUE TITLE
time.cloudflare.com curve negotiation issues

### ISSUE THREAD

**Issue by catharsis71** [cloudflare/cfnts#64]
I've observed that time.cloudflare.com only supports X25519, secp256r1, and secp384r1, which is fine, however, there's a strange misbehavior where when the client sends its supported curves list to the server, the FIRST item on the list must be  X25519, secp256r1, or secp384r1 or else the handshake will fail.  The server doesn't seem to look at anything beyond the first item on the list.

Testing X25519-only, this works, as expected:

```
$ openssl s_client -connect time.cloudflare.com:4460 -curves x25519 -brief
CONNECTION ESTABLISHED
Protocol version: TLSv1.3
Ciphersuite: TLS_AES_256_GCM_SHA384
Peer certificate: C = US, ST = California, L = San Francisco, O = "Cloudflare, Inc.", CN = time.cloudflare.com
Hash used: SHA256
Signature type: ECDSA
Verification: OK
Server Temp Key: X25519, 253 bits
^C
```

Testing X448-only, this fails, as expected, because the server does not support X448:

```
$ openssl s_client -connect time.cloudflare.com:4460 -curves x448 -brief
40073242FE7F0000:error:0A000126:SSL routines:ssl3_read_n:unexpected eof while reading:../ssl/record/rec_layer_s3.c:308:
```

Testing X25519/X448, this works, because X25519 is first on the list:

```
$ openssl s_client -connect time.cloudflare.com:4460 -curves X25519:X448 -brief
CONNECTION ESTABLISHED
Protocol version: TLSv1.3
Ciphersuite: TLS_AES_256_GCM_SHA384
Peer certificate: C = US, ST = California, L = San Francisco, O = "Cloudflare, Inc.", CN = time.cloudflare.com
Hash used: SHA256
Signature type: ECDSA
Verification: OK
Server Temp Key: X25519, 253 bits
^C
```

Testing X448/X25519, this SHOULD work, it should negotiate to X25519, however, because X25519 isn't FIRST on the list, the server kills the connection:

```
$ openssl s_client -connect time.cloudflare.com:4460 -curves X448:X25519 -brief
4007E3BCC27F0000:error:0A0003E7:SSL routines:tls_process_server_hello:invalid session id:../ssl/statem/statem_clnt.c:1467:
```

The same but with verbose output:

```
$ openssl s_client -connect time.cloudflare.com:4460 -curves X448:X25519 -security_debug_verbose
CONNECTED(00000003)
Security callback: Version=TLS 1.3: yes
Security callback: Version=TLS 1.3: yes
Security callback: Version=TLS 1.2: yes
Security callback: Version=TLS 1.1: no
Security callback: Version=TLS 1.0: no
Security callback: Version=TLS 1.3: yes
Security callback: Version=TLS 1.2: yes
Security callback: Version=TLS 1.1: no
Security callback: Version=TLS 1.0: no
Security callback: Signature Algorithm mask scheme=ecdsa_secp256r1_sha256, security bits=128: yes
Security callback: Signature Algorithm mask scheme=rsa_pss_pss_sha256, security bits=128: yes
Security callback: Signature Algorithm mask digest=SHA224, algorithm=DSA, security bits=112: yes
Security callback: Version=TLS 1.3: yes
Security callback: Version=TLS 1.2: yes
Security callback: Version=TLS 1.1: no
Security callback: Version=TLS 1.0: no
Security callback: Supported Ciphersuite=TLS_AES_256_GCM_SHA384, security bits=256: yes
Security callback: Supported Ciphersuite=TLS_CHACHA20_POLY1305_SHA256, security bits=256: yes
Security callback: Supported Ciphersuite=TLS_AES_128_GCM_SHA256, security bits=128: yes
Security callback: Supported Ciphersuite=ECDHE-ECDSA-AES256-GCM-SHA384, security bits=256: yes
Security callback: Supported Ciphersuite=ECDHE-RSA-AES256-GCM-SHA384, security bits=256: yes
Security callback: Supported Ciphersuite=DHE-RSA-AES256-GCM-SHA384, security bits=256: yes
Security callback: Supported Ciphersuite=ECDHE-ECDSA-CHACHA20-POLY1305, security bits=256: yes
Security callback: Supported Ciphersuite=ECDHE-RSA-CHACHA20-POLY1305, security bits=256: yes
Security callback: Supported Ciphersuite=DHE-RSA-CHACHA20-POLY1305, security bits=256: yes
Security callback: Supported Ciphersuite=ECDHE-ECDSA-AES128-GCM-SHA256, security bits=128: yes
Security callback: Supported Ciphersuite=ECDHE-RSA-AES128-GCM-SHA256, security bits=128: yes
Security callback: Supported Ciphersuite=DHE-RSA-AES128-GCM-SHA256, security bits=128: yes
Security callback: Supported Ciphersuite=ECDHE-ECDSA-AES256-SHA384, security bits=256: yes
Security callback: Supported Ciphersuite=ECDHE-RSA-AES256-SHA384, security bits=256: yes
Security callback: Supported Ciphersuite=DHE-RSA-AES256-SHA256, security bits=256: yes
Security callback: Supported Ciphersuite=ECDHE-ECDSA-AES128-SHA256, security bits=128: yes
Security callback: Supported Ciphersuite=ECDHE-RSA-AES128-SHA256, security bits=128: yes
Security callback: Supported Ciphersuite=DHE-RSA-AES128-SHA256, security bits=128: yes
Security callback: Supported Ciphersuite=ECDHE-ECDSA-AES256-SHA, security bits=256: yes
Security callback: Supported Ciphersuite=ECDHE-RSA-AES256-SHA, security bits=256: yes
Security callback: Supported Ciphersuite=DHE-RSA-AES256-SHA, security bits=256: yes
Security callback: Supported Ciphersuite=ECDHE-ECDSA-AES128-SHA, security bits=128: yes
Security callback: Supported Ciphersuite=ECDHE-RSA-AES128-SHA, security bits=128: yes
Security callback: Supported Ciphersuite=DHE-RSA-AES128-SHA, security bits=128: yes
Security callback: Supported Ciphersuite=AES256-GCM-SHA384, security bits=256: yes
Security callback: Supported Ciphersuite=AES128-GCM-SHA256, security bits=128: yes
Security callback: Supported Ciphersuite=AES256-SHA256, security bits=256: yes
Security callback: Supported Ciphersuite=AES128-SHA256, security bits=128: yes
Security callback: Supported Ciphersuite=AES256-SHA, security bits=256: yes
Security callback: Supported Ciphersuite=AES128-SHA, security bits=128: yes
Security callback: Version=TLS 1.3: yes
Security callback: Version=TLS 1.2: yes
Security callback: Version=TLS 1.1: no
Security callback: Version=TLS 1.0: no
Security callback: Version=TLS 1.3: yes
Security callback: Version=TLS 1.2: yes
Security callback: Version=TLS 1.1: no
Security callback: Version=TLS 1.0: no
Security callback: Signature Algorithm mask scheme=ecdsa_secp256r1_sha256, security bits=128: yes
Security callback: Signature Algorithm mask scheme=rsa_pss_pss_sha256, security bits=128: yes
Security callback: Signature Algorithm mask digest=SHA224, algorithm=DSA, security bits=112: yes
Security callback: Version=TLS 1.3: yes
Security callback: Version=TLS 1.2: yes
Security callback: Version=TLS 1.1: no
Security callback: Version=TLS 1.0: no
Security callback: Supported Ciphersuite=TLS_AES_256_GCM_SHA384, security bits=256: yes
Security callback: Supported Ciphersuite=TLS_CHACHA20_POLY1305_SHA256, security bits=256: yes
Security callback: Supported Ciphersuite=TLS_AES_128_GCM_SHA256, security bits=128: yes
Security callback: Supported Ciphersuite=ECDHE-ECDSA-AES256-GCM-SHA384, security bits=256: yes
Security callback: Supported Ciphersuite=ECDHE-RSA-AES256-GCM-SHA384, security bits=256: yes
Security callback: Supported Ciphersuite=DHE-RSA-AES256-GCM-SHA384, security bits=256: yes
Security callback: Supported Ciphersuite=ECDHE-ECDSA-CHACHA20-POLY1305, security bits=256: yes
Security callback: Supported Ciphersuite=ECDHE-RSA-CHACHA20-POLY1305, security bits=256: yes
Security callback: Supported Ciphersuite=DHE-RSA-CHACHA20-POLY1305, security bits=256: yes
Security callback: Supported Ciphersuite=ECDHE-ECDSA-AES128-GCM-SHA256, security bits=128: yes
Security callback: Supported Ciphersuite=ECDHE-RSA-AES128-GCM-SHA256, security bits=128: yes
Security callback: Supported Ciphersuite=DHE-RSA-AES128-GCM-SHA256, security bits=128: yes
Security callback: Supported Ciphersuite=ECDHE-ECDSA-AES256-SHA384, security bits=256: yes
Security callback: Supported Ciphersuite=ECDHE-RSA-AES256-SHA384, security bits=256: yes
Security callback: Supported Ciphersuite=DHE-RSA-AES256-SHA256, security bits=256: yes
Security callback: Supported Ciphersuite=ECDHE-ECDSA-AES128-SHA256, security bits=128: yes
Security callback: Supported Ciphersuite=ECDHE-RSA-AES128-SHA256, security bits=128: yes
Security callback: Supported Ciphersuite=DHE-RSA-AES128-SHA256, security bits=128: yes
Security callback: Supported Ciphersuite=ECDHE-ECDSA-AES256-SHA, security bits=256: yes
Security callback: Supported Ciphersuite=ECDHE-RSA-AES256-SHA, security bits=256: yes
Security callback: Supported Ciphersuite=DHE-RSA-AES256-SHA, security bits=256: yes
Security callback: Supported Ciphersuite=ECDHE-ECDSA-AES128-SHA, security bits=128: yes
Security callback: Supported Ciphersuite=ECDHE-RSA-AES128-SHA, security bits=128: yes
Security callback: Supported Ciphersuite=DHE-RSA-AES128-SHA, security bits=128: yes
Security callback: Supported Ciphersuite=AES256-GCM-SHA384, security bits=256: yes
Security callback: Supported Ciphersuite=AES128-GCM-SHA256, security bits=128: yes
Security callback: Supported Ciphersuite=AES256-SHA256, security bits=256: yes
Security callback: Supported Ciphersuite=AES128-SHA256, security bits=128: yes
Security callback: Supported Ciphersuite=AES256-SHA, security bits=256: yes
Security callback: Supported Ciphersuite=AES128-SHA, security bits=128: yes
Security callback: Supported Curve=X448, security bits=224: yes
Security callback: Version=TLS 1.3: yes
Security callback: Version=TLS 1.2: yes
Security callback: Version=TLS 1.1: no
Security callback: Version=TLS 1.0: no
Security callback: Signature Algorithm mask scheme=ecdsa_secp256r1_sha256, security bits=128: yes
Security callback: Signature Algorithm mask scheme=rsa_pss_pss_sha256, security bits=128: yes
Security callback: Signature Algorithm mask digest=SHA224, algorithm=DSA, security bits=112: yes
Security callback: Version=TLS 1.3: yes
Security callback: Version=TLS 1.2: yes
Security callback: Version=TLS 1.1: no
Security callback: Version=TLS 1.0: no
Security callback: Supported Ciphersuite=TLS_AES_256_GCM_SHA384, security bits=256: yes
Security callback: Supported Ciphersuite=TLS_CHACHA20_POLY1305_SHA256, security bits=256: yes
Security callback: Supported Ciphersuite=TLS_AES_128_GCM_SHA256, security bits=128: yes
Security callback: Supported Ciphersuite=ECDHE-ECDSA-AES256-GCM-SHA384, security bits=256: yes
Security callback: Supported Ciphersuite=ECDHE-RSA-AES256-GCM-SHA384, security bits=256: yes
Security callback: Supported Ciphersuite=DHE-RSA-AES256-GCM-SHA384, security bits=256: yes
Security callback: Supported Ciphersuite=ECDHE-ECDSA-CHACHA20-POLY1305, security bits=256: yes
Security callback: Supported Ciphersuite=ECDHE-RSA-CHACHA20-POLY1305, security bits=256: yes
Security callback: Supported Ciphersuite=DHE-RSA-CHACHA20-POLY1305, security bits=256: yes
Security callback: Supported Ciphersuite=ECDHE-ECDSA-AES128-GCM-SHA256, security bits=128: yes
Security callback: Supported Ciphersuite=ECDHE-RSA-AES128-GCM-SHA256, security bits=128: yes
Security callback: Supported Ciphersuite=DHE-RSA-AES128-GCM-SHA256, security bits=128: yes
Security callback: Supported Ciphersuite=ECDHE-ECDSA-AES256-SHA384, security bits=256: yes
Security callback: Supported Ciphersuite=ECDHE-RSA-AES256-SHA384, security bits=256: yes
Security callback: Supported Ciphersuite=DHE-RSA-AES256-SHA256, security bits=256: yes
Security callback: Supported Ciphersuite=ECDHE-ECDSA-AES128-SHA256, security bits=128: yes
Security callback: Supported Ciphersuite=ECDHE-RSA-AES128-SHA256, security bits=128: yes
Security callback: Supported Ciphersuite=DHE-RSA-AES128-SHA256, security bits=128: yes
Security callback: Supported Ciphersuite=ECDHE-ECDSA-AES256-SHA, security bits=256: yes
Security callback: Supported Ciphersuite=ECDHE-RSA-AES256-SHA, security bits=256: yes
Security callback: Supported Ciphersuite=DHE-RSA-AES256-SHA, security bits=256: yes
Security callback: Supported Ciphersuite=ECDHE-ECDSA-AES128-SHA, security bits=128: yes
Security callback: Supported Ciphersuite=ECDHE-RSA-AES128-SHA, security bits=128: yes
Security callback: Supported Ciphersuite=DHE-RSA-AES128-SHA, security bits=128: yes
Security callback: Supported Ciphersuite=AES256-GCM-SHA384, security bits=256: yes
Security callback: Supported Ciphersuite=AES128-GCM-SHA256, security bits=128: yes
Security callback: Supported Ciphersuite=AES256-SHA256, security bits=256: yes
Security callback: Supported Ciphersuite=AES128-SHA256, security bits=128: yes
Security callback: Supported Ciphersuite=AES256-SHA, security bits=256: yes
Security callback: Supported Ciphersuite=AES128-SHA, security bits=128: yes
Security callback: Supported Curve=X448, security bits=224: yes
Security callback: Supported Curve=X448, security bits=224: yes
Security callback: Supported Curve=X25519, security bits=128: yes
Security callback: : yes
Security callback: Supported Signature Algorithm scheme=ecdsa_secp256r1_sha256, security bits=128: yes
Security callback: Supported Signature Algorithm scheme=ecdsa_secp384r1_sha384, security bits=192: yes
Security callback: Supported Signature Algorithm scheme=ecdsa_secp521r1_sha512, security bits=256: yes
Security callback: Supported Signature Algorithm scheme=ed25519, security bits=128: yes
Security callback: Supported Signature Algorithm scheme=ed448, security bits=224: yes
Security callback: Supported Signature Algorithm scheme=rsa_pss_pss_sha256, security bits=128: yes
Security callback: Supported Signature Algorithm scheme=rsa_pss_pss_sha384, security bits=192: yes
Security callback: Supported Signature Algorithm scheme=rsa_pss_pss_sha512, security bits=256: yes
Security callback: Supported Signature Algorithm scheme=rsa_pss_rsae_sha256, security bits=128: yes
Security callback: Supported Signature Algorithm scheme=rsa_pss_rsae_sha384, security bits=192: yes
Security callback: Supported Signature Algorithm scheme=rsa_pss_rsae_sha512, security bits=256: yes
Security callback: Supported Signature Algorithm scheme=rsa_pkcs1_sha256, security bits=128: yes
Security callback: Supported Signature Algorithm scheme=rsa_pkcs1_sha384, security bits=192: yes
Security callback: Supported Signature Algorithm scheme=rsa_pkcs1_sha512, security bits=256: yes
Security callback: Supported Signature Algorithm digest=SHA224, algorithm=ECDSA, security bits=112: yes
Security callback: Supported Signature Algorithm scheme=ecdsa_sha1, security bits=64: no
Security callback: Supported Signature Algorithm digest=SHA224, algorithm=RSA, security bits=112: yes
Security callback: Supported Signature Algorithm scheme=rsa_pkcs1_sha1, security bits=64: no
Security callback: Supported Signature Algorithm digest=SHA224, algorithm=DSA, security bits=112: yes
Security callback: Supported Signature Algorithm digest=SHA1, algorithm=DSA, security bits=64: no
Security callback: Supported Signature Algorithm digest=SHA256, algorithm=DSA, security bits=128: yes
Security callback: Supported Signature Algorithm digest=SHA384, algorithm=DSA, security bits=192: yes
Security callback: Supported Signature Algorithm digest=SHA512, algorithm=DSA, security bits=256: yes
Security callback: Version=TLS 1.3: yes
Security callback: Version=TLS 1.2: yes
Security callback: Version=TLS 1.1: no
Security callback: Version=TLS 1.0: no
Security callback: Supported Curve=X448, security bits=224: yes
4007BF56547F0000:error:0A0003E7:SSL routines:tls_process_server_hello:invalid session id:../ssl/statem/statem_clnt.c:1467:
---
no peer certificate available
---
No client certificate CA names sent
---
SSL handshake has read 61 bytes and written 336 bytes
Verification: OK
---
New, (NONE), Cipher is (NONE)
Secure Renegotiation IS NOT supported
Compression: NONE
Expansion: NONE
No ALPN negotiated
Early data was not sent
Verify return code: 0 (ok)
---
```

Packet captures confirmed that the client is indeed including both X448 and X25519 in "supported_groups"

I'm not an expert on SSL negotiation but I think one possibility is that the server is looking at "key_share" (which will only contain one item) instead of "supported_groups"

**Comment by catharsis71** [comment]
as for how this is affecting me... my ntpsec servers were communicating with time.cloudflare.com properly, because they were using X25519 as their first-choice curve (this is OpenSSL default).

but then I enabled postquantum support, and I wanted to set x25519_kyber768 as my first-choice group, with normal x25519 as second-choice

that caused communication with only time.cloudflare.com to break (all other NTS servers I know of took it in stride, mostly negotiating down to x25519)

on further investigation, it turned out not to be an issue specific to postquantum but to time.cloudflare.com's very strange behavior of only looking at the first item on the list sent by the client and bailing out if it's not one of the 3 supported curves, without checking the rest of the list

**Comment by Lekensteyn** [comment]
Hey, thanks for the report and reproducer. There is indeed a problem with the TLS server implementation. We'll look into addressing the issue. Maybe we can also add PQ while at it :)

```
    4   0.019565   172.16.0.2 → 162.159.200.1 TLSv1 385 Client Hello
    6   0.034509 162.159.200.1 → 172.16.0.2   TLSv1.3 123 Hello Retry Request, Change Cipher Spec
    8   0.034645   172.16.0.2 → 162.159.200.1 TLSv1.3 63 Alert (Level: Fatal, Description: Illegal Parameter)
```

The HRR contains a non-empty Session ID which is not [TLS 1.3 compliant](https://datatracker.ietf.org/doc/html/rfc8446#appendix-D.4):
```
Internet Protocol Version 4, Src: 162.159.200.1, Dst: 172.16.0.2
Transmission Control Protocol, Src Port: 4460, Dst Port: 50801, Seq: 1, Ack: 330, Len: 67
Transport Layer Security
    TLSv1.2 Record Layer: Handshake Protocol: Hello Retry Request
        Content Type: Handshake (22)
        Version: TLS 1.2 (0x0303)
        Length: 56
        Handshake Protocol: Hello Retry Request
            Handshake Type: Server Hello (2)
            Length: 52
            Version: TLS 1.2 (0x0303)
            Random: cf21ad74e59a6111be1d8c021e65b891c2a211167abb8c5e079e09e2c8a8339c (HelloRetryRequest magic)
            Session ID Length: 0 <-- problematic
            Cipher Suite: TLS_AES_256_GCM_SHA384 (0x1302)
            Compression Method: null (0)
            Extensions Length: 12
            Extension: key_share (len=2)
                Type: key_share (51)
                Length: 2
                Key Share extension
                    Selected Group: x25519 (29)
            Extension: supported_versions (len=2)
                Type: supported_versions (43)
                Length: 2
                Supported Version: TLS 1.3 (0x0304)
            [JA3S Fullstring: 771,4866,51-43]
            [JA3S: 907bf3ecef1c987c889946b737b43de8]
    TLSv1.3 Record Layer: Change Cipher Spec Protocol: Change Cipher Spec
        Content Type: Change Cipher Spec (20)
        Version: TLS 1.2 (0x0303)
        Length: 1
        Change Cipher Spec Message
```

**Comment by cjpatton** [comment]
HI @catharsis71, thanks again for the report. The HRR issue has been fixed, you should be able to confirm on your side.

Unfortunately we don't have plans to enable PQ key exchange for this particular service in the near future. But stay tuned!

**Comment by Lekensteyn** [comment]
The fix has been deployed, closing issue.

```
$ openssl s_client -connect time.cloudflare.com:4460 -curves x448 -brief
40C76814B67F0000:error:0A000410:SSL routines:ssl3_read_bytes:sslv3 alert handshake failure:../ssl/record/rec_layer_s3.c:1586:SSL alert number 40

$ openssl s_client -connect time.cloudflare.com:4460 -curves x448:x25519 -brief
CONNECTION ESTABLISHED
Protocol version: TLSv1.3
Ciphersuite: TLS_AES_256_GCM_SHA384
Peer certificate: C = US, ST = California, L = San Francisco, O = "Cloudflare, Inc.", CN = time.cloudflare.com
Hash used: SHA256
Signature type: ECDSA
Verification: OK
Server Temp Key: X25519, 253 bits
^C
```
